CnT Architects,CnT Architects,"CnT Architects (earlier known as Chandavarkar & Thacker Architects Pvt Ltd.) traces its roots back to being Bangalore's first architectural firm with its practice founded by the late Mr. Narayan Chandavarkar in 1947. It was reorganised under Chandavarkar & Thacker Architects Pvt. Ltd. in 1963 by Mrs. Tara Chandavarkar and the late Mr. Pesi Thacker. The firm is currently overseen by Prem Chandavarkar.
Through its various generations, CnT has retained a value system that focuses on high-quality design, ethical practice and a working philosophy based on courtesy consideration and collaboration.",62,"Bengaluru, Hyderabad",http://www.cnt.co.in/,Prem Chandavarkar,Managing Partner,918023341002,1 to 50 Lakhs,Commercial,111_logo.jpg,111_a.jpg,111_b.jpg,111_c.jpg,111_d.jpg,111_e.jpg,111_f.jpg,111_g.jpg,111_h.jpg,111_i.jpg,111_j.jpg,,,,111_reviews.jpg,contact@cnt.co.in,4.4,135,"https://www.google.com/maps/place/CnT+Architects/@12.9968443,77.58723,15z/data=!4m2!3m1!1s0x0:0x11f867e47b3f0f4f?sa=X&ved=1t:2428&ictx=111",,,1.38
Arclain Design Studio,Arclain Design Studio,"ARCLAIN is a leading Bangalore-Ahmedabad-based Architecture & Interior design firm. This well-recognized organization has excelled in designing world-class spaces that stand as exemplars of a balance between luxury and sustainability. ARCLAIN Design Studio was founded by the entrepreneurs-turned-architects Khajan Patel and Karun Muthanna. This talented duo has graduated from one of Australia’s top universities and has gathered up extensive work experience overseas.

The co-founders have received tons of appreciation for their unique approach; their designs have caught the eye of some world-renowned organizations, bringing in international nominations for the impressive creativity they’ve brought to life in their various projects. One such project is their Subway outlet at the Kempegowda International Airport. This Subway outlet has recorded the highest unit sales worldwide of this quick-service restaurant chain.

Built into their name are their three areas of expertise.

ARC stands for Architecture, LA for landscapes and IN for Interiors. With more than a decade of experience, ARCLAIN has designed and built innovative spaces ranging from chic commercial stores to cosy retreats and luxurious residential projects.

ARCLAIN adopts a redefined approach for a luxurious and humane design, sensitive to the environment and the traditional culture of the client.",,"Bengaluru, Ahmedabad",http://arclain.com/,Khajan Patel,Co-Founder,919687652700,1 to 50 Lakhs,"Residential, Commercial",112_logo.jpg,112_a.jpg,112_b.jpg,112_c.jpg,112_d.jpg,112_e.jpg,112_f.jpg,112_g.jpg,112_h.jpg,112_i.jpg,112_j.jpg,,,,112_reviews.jpg,contactus@arclain.com,4.3,6,"https://www.google.com/maps/place/Arclain+Design+Studio/@12.9654702,77.6131683,15z/data=!4m2!3m1!1s0x0:0x424badf139064cdd?sa=X&ved=1t:2428&ictx=111",,,0.05
UX9 Ventures,UX9,"UX9, where innovation meets excellence in the realm of real estate. As a dynamic venture, UX9 is your one-stop destination for a comprehensive range of services, seamlessly navigating the realms of commercial interiors, residential interiors, construction, property leasing, and consulting. Our commitment to precision and passion sets us apart, ensuring that every project we undertake is a masterpiece in itself. With a team of dedicated professionals and a client-centric approach, UX9 is not just a real estate solution; it's a journey towards spaces that redefine living and working.",6,Bengaluru,https://www.ux-9.com/,Swaroop Kishan,Founder,919902263587,1 to 50 Lakhs,"Residential, Commercial",113_logo.jpg,113_a.jpg,113_b.jpg,113_c.jpg,113_d.jpg,113_e.jpg,113_f.jpg,113_g.jpg,113_h.jpg,113_i.jpg,113_j.jpg,,,,113_reviews.jpg,hello@ux-9.com,3.6,66,"https://www.google.com/maps/place/UX9/@12.9821362,77.598503,15z/data=!4m2!3m1!1s0x0:0xd5e298e503741c2f?sa=X&ved=1t:2428&ictx=111",,,0.98
Alluring Interior,Alluring Interior,"Your search for the best interior design in India ends here! Alluring Interior is the top interior design organization in India. As far as productivity and viability, while finishing interior design projects, we are the awesome rundown of interior design organizations in India.

Alluring Interior is a full-administration interior design organization giving luxury interior plan and home stylistic layout administrations. Our services incorporate interior plan, engineering, office, residential and commercial places

Our group of regarded interior architects and decorators has gained a good reputation for changing unremarkable spaces into style amazing units. In light of long periods of neighborhood and global experience, we have fostered an interaction to furnish our customers with a consistent experience when planning their homes and estates.",20,Bengaluru,https://alluringinterior.com/,Mohamed Rafiq RS,CEO and Co-Founder,917892222681,1 to 50 Lakhs,"Residential, Commercial",114_logo.jpg,114_a.jpg,114_b.jpg,114_c.jpg,114_d.jpg,114_e.jpg,114_f.jpg,114_g.jpg,114_h.jpg,114_i.jpg,114_j.jpg,,500.0,,114_reviews.jpg,info@alluringinterior.com,5.0,3,"https://www.google.com/maps/place/Alluring+Interior+-+Interior+Designers+in+Bangalore/@13.0259587,77.6263892,15z/data=!4m2!3m1!1s0x0:0x35b1b897592ae78f?sa=X&ved=1t:2428&ictx=111",,,1.03
Beveledge,Beveledge,"Beveledge is the starting point of a lifelong goal to create. It seeks to evoke a similar sense of fulfillment through space.
When it comes to interior design, we create spaces that are timeless. We’re proud to rely on strong fundamentals in our space planning. There is no compromise on the client’s needs.
Our designs are elegant yet agile. We respect the brief and don’t drain additional resources to achieve the goals we agree upon.
Clients are the focal point of our process. Our studio brings together experienced consultants and designers who strike the balance between functionality and creativity. Our design process is a journey of constant collaboration and clear communication with the clients, consultants and artists resulting in a space with a strong unmistakable identity.
Although meticulous and structured, we ensure the process is organic and enjoyable for those involved. At Beveledge, we are meticulous throughout the pre-concept and concept design to schematic space planning. At the end of multiple brainstorming sessions, we move forward only when the client is convinced we’ve got it right. This gives the project a solid foundation. After, we dive headfirst into obsessive detailing of the space to give it that bespoke elegance. Our craftsmen and vendors are seasoned at what they do and deliver the results that match client expectations, nothing less. As the project shapes up, our tempo lasts till we have created something we all can be proud of.",7,Bengaluru,http://beveledge.in/,Lasya Umesh,Founder,919663770077,1 to 50 Lakhs,Residential,115_logo.jpg,115_a.jpg,115_b.jpg,115_c.jpg,115_d.jpg,115_e.jpg,115_f.jpg,115_g.jpg,115_h.jpg,115_i.jpg,115_j.jpg,,,,115_reviews.jpg,lasyaumesh@beveledge.in,3.8,4,"https://www.google.com/maps/place/Beveledge+-+Interior+Design+Studio/@12.9809303,77.6032332,15z/data=!4m2!3m1!1s0x0:0x3ca3f1b8301d3a65?sa=X&ved=1t:2428&ictx=111",,,0.53
Space Concepts,Space Concepts,"Space Concepts is an interior design and furniture manufacturing company based in Bangalore, India. We have built a team of professionals who are passionate about creating beautiful, functional spaces. Our mission is to bring a unique touch to your home or office and create spaces that are tailored to your needs.",14,Bengaluru,https://spaceconcepts.co.in/,Shrikanth Kiran,Interior Designer,919844444001,1 to 50 Lakhs,Residential,116_logo.jpg,116_a.jpg,116_b.jpg,116_c.jpg,116_d.jpg,116_e.jpg,116_f.jpg,116_g.jpg,116_h.jpg,116_i.jpg,116_j.jpg,,,,116_reviews.jpg,spaceconcepts@hotmail.com,4.7,22,"https://www.google.com/maps/place/Space+Concepts/@12.9718314,77.6002576,15z/data=!4m2!3m1!1s0x0:0x37e4c1511edf62ad?sa=X&ved=1t:2428&ictx=111",,,0.71
OIB,Office in a Box,"Established in 2020 under the visionary leadership of Ar. Hitendra Jain, OIB stands as a boutique interior design firm dedicated to crafting state-of-the-art projects through a blend of cutting-edge technology and global design methodologies. Innovative Design, Technology
Driven Solutions Acknowledging the role of Information Technology in design, our innovative and customized approach integrates the latest digital technologies. With relevant updated software and cutting-edge hardware tools, we exhibit vivid 3D visualizations for spatial designs with accuracy and precision, ensuring the delivery of a premium execution. A Commitment at OIB, our commitment extends to the steady curation of spatial ideas that meet the demands of the ever-evolving AEC industry. Our designs are visually powerful, intellectually elegant, and, above all, timeless. Join us on a journey of elevating spaces and defining elegance.",5,Bengaluru,http://www.officeinabox.co.in/,Hitendra Jain,Founder,919900558254,1 to 50 Lakhs,"Residential, Commercial",117_logo.jpg,117_a.jpg,117_b.jpg,117_c.jpg,117_d.jpg,117_e.jpg,117_f.jpg,117_g.jpg,117_h.jpg,117_i.jpg,117_j.jpg,,,,117_reviews.jpg,info@officeinabox.co.in,5.0,14,"https://www.google.com/maps/place/Office+in+a+Box/@12.9575148,77.5859152,15z/data=!4m2!3m1!1s0x0:0x2a3efd73fd9ebcbf?sa=X&ved=1t:2428&ictx=111",,,0.64
One Source,One Source,"One Source is a pioneer in the Indian market for the supply of interior products since 2002. We take immense pride in our expertise, which enables us to consistently meet our clients' desired state of satisfaction. With excellent relationships established with leading architects, PMC's, and contractors, we have become a trusted name in the industry.



Based in Bangalore, we also have an office in Chennai, strategically positioned to cater to a wider clientele. Our presence in multiple cities allows us to extend our exceptional services to various regions.



Over the years, we have successfully delivered over 50 lakh square feet of meticulously designed and executed interior spaces throughout South India. This track record speaks volumes about our commitment to quality and our ability to bring our clients' visions to life.



At One Source, we understand the significance of creating spaces that not only meet functional requirements but also inspire and uplift. With our vast range of interior products and materials, combined with our dedicated team of experts, we strive to transform ordinary spaces into extraordinary ones.



Experience the difference of working with a trusted industry leader. Choose One Source and let us redefine the way you perceive interior solutions.",23,"Bengaluru, Chennai",https://onesourceglobal.in/,Dinesh Kumar,Founder,919066668884,1 to 50 Lakhs,Residential,118_logo.jpg,118_a.jpg,118_b.jpg,118_c.jpg,118_d.jpg,118_e.jpg,118_f.jpg,118_g.jpg,118_h.jpg,118_i.jpg,118_j.jpg,,750.0,,118_reviews.jpg,sales@onesourceglobal.in,4.5,51,"https://www.google.com/maps/place/One+Source/@12.9593614,77.5945796,15z/data=!4m2!3m1!1s0x0:0x5eab17f55d0124c6?sa=X&ved=1t:2428&ictx=111",,,1.46
D-Space Interio,D-Space Interio,"We are professional interior and architectural designer from bangalore, we focus on commercial and residential projects as well, we are inspired working along side our clients to simplify complex challenges and design",7,Bengaluru,,Mohamed Najad,Managing Director,918310732639,1 to 50 Lakhs,"Residential, Commercial",119_logo.jpg,119_a.jpg,119_b.jpg,119_c.jpg,119_d.jpg,119_e.jpg,119_f.jpg,119_g.jpg,119_h.jpg,119_i.jpg,119_j.jpg,,,,119_reviews.jpg,,3.6,19,"https://www.google.com/maps/place/dspaceinterio/@12.9736036,77.6125207,15z/data=!4m2!3m1!1s0x0:0x39b83d232ffa9f5?sa=X&ved=1t:2428&ictx=111",,,0.64
Teekays Interior Solutions Pvt. Ltd.,Teekays,"Teekays Interior Solutions is a leading name in creation and management of corporate work places and offers end-to-end services in interior fit-out solutions. 

Over the years, we, as an ISO 9001:2008 certified company, have emerged as a high performance organization with offices all over India. We have successfully completed interior fit-out jobs for over 600 corporate clients like IBM, Accenture, Hyatt Regency, TCS, PepsiCo, Dell, ICICI, Alcatel Lucent, Reliance and others.

We undertake interior fit-out projects in all sectors like IT/ITES, Corporates, Banks, Institutes, Hospitality, Healthcare and others. 

We have a rich experience of  over 20 years and a large team of in-house designers, engineers, project managers and vendor coordinators with multi-locational presence, wide network of vendors, over 2000 strong workforce and own state-of-the-art manufacturing facility for custom-built furniture.",20,"Bengaluru, Hyderabad, Chennai, Delhi, Mangalore, Mumbai",https://www.teekays.com/,Manjunath C,GM-Projects,918042274447,1 to 50 Lakhs,Commercial,120_logo.jpg,120_a.jpg,120_b.jpg,120_c.jpg,120_d.jpg,120_e.jpg,120_f.jpg,120_g.jpg,120_h.jpg,120_i.jpg,120_j.jpg,,500.0,,120_reviews.jpg,manjunath.c@teekays.com,3.8,18,"https://www.google.com/maps/place/Teekays+Interior+Solutions+Pvt+Ltd/@12.9847134,77.6009482,15z/data=!4m2!3m1!1s0x0:0x383f1158232c8bc0?sa=X&ved=1t:2428&ictx=111",,,1.14
EnSculp,EnSculp,"""EnSculp—“within a sculpture”—is a design-build architectural and interior design studio that specializes in creating customized residential spaces with a unique sculptural aesthetic. Our experienced team of architects, contractors, and skilled craftsmen have a keen eye for detail and a passion for creating designs that are both functional and beautiful.

All of our projects are tailored to the specific desires and needs of our clients. We take the time to understand their vision and lifestyle, and use that knowledge to create living spaces that are not only comfortable but also truly feel like living within a sculpture. Our goal is to provide our clients with timeless designs that are sustainable and will last for years to come.  



At EnSculp,

We are a team of experts dedicated to creating homes that not only look beautiful, but are also functional and efficient. for a truly personalized home design experience.

We understand the importance of a home and strive to make the process of building or renovating a home as stress-free as possible for our clients. Our dedicated team will work with you every step of the way, ensuring a transparent and seamless construction process. 

Built with skilled craftsmanship and attention to detail using only the highest quality materials and adherence to international standards, our works deliver a superior living experience.",5,Bengaluru,https://ensculp.com/,Praveen R,Co-Founder,919113681197,1 to 50 Lakhs,Residential,121_logo.jpg,121_a.jpg,121_b.jpg,121_c.jpg,121_d.jpg,121_e.jpg,121_f.jpg,121_g.jpg,121_h.jpg,121_i.jpg,121_j.jpg,,,,121_reviews.jpg,info@ensculp.com,5.0,9,"https://www.google.com/maps/place/ENSCULP/@12.973372,77.6162943,15z/data=!4m2!3m1!1s0x0:0xbed4249be853a539?sa=X&ved=1t:2428&ictx=111",,,0.59
Acorp Consultants Pvt Ltd,Acorp,"At Acorp, we believe in creating spaces that are inspired and empowered by your brand. By capitalizing on creativity, innovation and enhanced collaboration, we aim to bring out truly exceptional workplace solutions. 
As a design centric studio with strong build capabilities, we ensure high quality workmanship and facilitate time and cost efficiency.",6,Bengaluru,https://www.acorp.ltd/,Atish Kumar,Founder & Managing Director,918217748742,1 to 50 Lakhs,Commercial,122_logo.jpg,122_a.jpg,122_b.jpg,122_c.jpg,122_d.jpg,122_e.jpg,122_f.jpg,122_g.jpg,122_h.jpg,122_i.jpg,122_j.jpg,,,,122_reviews.jpg,admin@acorp.ltd,4.4,20,"https://www.google.com/maps/place/Acorp+Consultants+Pvt+Ltd/@12.9750832,77.6192903,15z/data=!4m2!3m1!1s0x0:0x5fc4b64f3c68723a?sa=X&ved=1t:2428&ictx=111",,,0.68
Innovarch Architects India Pvt Ltd,Innovarch Architects,"Innovarch architects is an architectural, interior design, planning, and urban design firm established in 2001, we are committed to design excellence, social responsibility, and sustainability. Our diverse portfolio of projects includes work of all types and scales are based on our core commitment to enriching the built environment by creating projects with social, environmental, and aesthetic integrity. innovarch employs an interactive, collaborative design process by implementing effective leadership and open communication. This approach establishes a working environment of trust that enables clients to make fully informed decisions during the design process, reach consensus, and move forward to the successful completion of the project. We are committed to our core value of design excellence. The goal always is the creation of credible and intelligent design, which is driven by strong ideas.",24,Bengaluru,,Chandra Shekar Venkataramu,Architect,918022226711,1 to 50 Lakhs,Commercial,123_logo.jpg,123_a.jpg,123_b.jpg,123_c.jpg,123_d.jpg,123_e.jpg,123_f.jpg,123_g.jpg,123_h.jpg,123_i.jpg,123_j.jpg,,,,123_reviews.jpg,info@innovarch.in,4.6,31,"https://www.google.com/maps/place/Innovarch+Architects/@12.9708624,77.6016171,15z/data=!4m2!3m1!1s0x0:0x85d091ad4e0d445f?sa=X&ved=1t:2428&ictx=111",,,0.79
AD Studio 9,AD Studio 9,"Creating solutions that are simple and practical is the essence of our design.

We believe, when a design is based on simplicity and honesty it is naturally beautiful. WE PAY ATTENTION to your requirements.

DESIGN SOLUTION that are tailored to the individual needs with a purpose of solving challenges.

TO CREATE the best design language, we strive to make function as priority over asthetics.",6,Bengaluru,https://adstudio9.com/,Apoorva Lekha,Principal Architect,918088970299,1 to 50 Lakhs,"Residential, Commercial",124_logo.jpg,124_a.jpg,124_b.jpg,124_c.jpg,124_d.jpg,124_e.jpg,124_f.jpg,124_g.jpg,124_h.jpg,124_i.jpg,124_j.jpg,,,,124_reviews.jpg,info@adstudio9.com,4.9,14,"https://www.google.com/maps/place/AD+Studio+9/@12.9736021,77.6092298,15z/data=!4m2!3m1!1s0x0:0xe8c7760bef8ed2d2?sa=X&ved=1t:2428&ictx=111",,,0.64
Wildhub Designs Pvt Ltd,Wildhub Designs,"Wildhub Designs Pvt Ltd is a multi disciplinary organisation diversified into different aspects of design consultancy and construction. We are community, family and team oriented. We are motivated by integrity and by pride in the results of our work.


Communication between clients, staff and owner has been the reason for our success, along with a large amount of sweat and work ethic.",8,Bengaluru,https://wildhubdesigns.com/,Md Nayeem,Revit Architect,919606668733,1 to 50 Lakhs,"Residential, Commercial",125_logo.jpg,125_a.jpg,125_b.jpg,125_c.jpg,125_d.jpg,125_e.jpg,125_f.jpg,125_g.jpg,125_h.jpg,125_i.jpg,125_j.jpg,,,,125_reviews.jpg,contact@wildhubdesigns.com,4.0,111,"https://www.google.com/maps/place/Wildhub+Designs+pvt+ltd/@12.9731571,77.6089659,15z/data=!4m2!3m1!1s0x0:0xd473b4b90a58565f?sa=X&ved=1t:2428&ictx=111",,,1.3
Artisanal Design Collective,Artisanal Design Collective,"Artisanal design incorporates unique, one-of-a-kind elements and a mix of traditional and contemporary design elements. Our style is characterised by a focus on a mix of materials, such as wood, stone, textiles and an emphasis on craftsmanship and attention to detail. The end result is warm, inviting spaces that are both functional and visually appealing.

Our design collective may members from different areas of expertise, such as graphic design, product design, or architecture, and they collaborate to bring a diverse set of skills and perspectives to the projects they work on.",4,Bengaluru,http://adcollective.in/,Rashmin Perla,Founder and Design Principal,919845190037,1 to 50 Lakhs,"Residential, Commercial",126_logo.jpg,126_a.jpg,126_b.jpg,126_c.jpg,126_d.jpg,126_e.jpg,126_f.jpg,126_g.jpg,126_h.jpg,126_i.jpg,126_j.jpg,,,,126_reviews.jpg,design@adcollective.in,4.0,4,"https://www.google.com/maps/place/Artisanal+Design+Collective/@12.9863044,77.5964587,15z/data=!4m2!3m1!1s0x0:0xc3fa3c5c5a81711a?sa=X&ved=1t:2428&ictx=111",,,0.43
Billimoria & Associates,Billimoria Architects,"Billimoria & Associates was founded in 2001 by Darius Billimoria, 5 years after graduating from an architecture College in Bangalore, India. The firm offers architecture and interior design services, and over the course of a decade in the practice, has handled projects in the residential, commercial, hospitality and institutional sectors. The firm comprises a team of young professionals attuned to the modern aesthetic and psyche- and thus strives to produce designs that are relevant, practical, client specific and sensitive to environmental and climatoligical concerns.",24,Bengaluru,https://billimoriaarchitecture.com/,Darius Billimoria,Founder,918022389396,1 to 50 Lakhs,"Residential, Commercial",127_logo.jpg,127_a.jpg,127_b.jpg,127_c.jpg,127_d.jpg,127_e.jpg,127_f.jpg,127_g.jpg,127_h.jpg,127_i.jpg,127_j.jpg,,,,127_reviews.jpg,team@billimoriaarchitecture.com,4.7,19,"https://www.google.com/maps/place/Billimoria+%26+Associates/@12.9849603,77.5879447,15z/data=!4m2!3m1!1s0x0:0x876ef6a0e22454bb?sa=X&ved=1t:2428&ictx=111",,,0.68
Design Your Nest,Design Your Nest,"Design Your Nest is an Architectural and Interior Design Firm. Our goal is to bridge the gap that exists between “Pure” Design and the contingencies of Construction exposed to New and Innovative material sensitivity to the requirements of the Customer. We ensure that we understand the needs and demands of the home owners carefully. We make the layout of the home and a plan to improve the existing interior of the home and execute it in an organized way. Our Vision is, we are passionate to serve and focus on building a long term relationship with our customers.",5,Bengaluru,https://designyournest.in/,Shitiz Garg,Founder & Chief Architect,919731034747,1 to 50 Lakhs,Residential,128_logo.jpg,128_a.jpg,128_b.jpg,128_c.jpg,128_d.jpg,128_e.jpg,128_f.jpg,128_g.jpg,128_h.jpg,128_i.jpg,128_j.jpg,,150.0,,128_reviews.jpg,connect@designyournest.in,4.7,61,"https://www.google.com/maps/place/Design+Your+Nest/@13.0391591,77.5539408,15z/data=!4m2!3m1!1s0x0:0x5429e93e94092778?sa=X&ved=1t:2428&ictx=111", they have won 27+ Awards so far in their journey,,1.82
Maa Shakti Studio,Maa Shakti Studio,"At Maa Shakti Studio, we are the premier choice for interior design services. Our knowledgeable and experienced team of professionals will work closely with you to create a custom interior that is both stylish and functional.

 

We specialize in designing spaces that are tailored to your individual style, taste, and personality, while also being mindful of your budget.

 

Our attention to detail and commitment to quality ensures that each project is completed with the highest level of care, so that you can be sure that your interior design will stand the test of time.",2,Bengaluru,https://www.maashaktistudio.com/,Chirag Jain,Founder,917829100821,1 to 50 Lakhs,"Residential, Commercial",129_logo.jpg,129_a.jpg,129_b.jpg,129_c.jpg,129_d.jpg,129_e.jpg,129_f.jpg,129_g.jpg,129_h.jpg,129_i.jpg,129_j.jpg,,,,129_reviews.jpg,contact.maashaktistudio@gmail.com,5.0,1,"https://www.google.com/maps/place/Maa+Shakti+Studio+-+Interior+Design+Studio/@12.9529298,77.5774948,15z/data=!4m2!3m1!1s0x0:0x520554babeaef95e?sa=X&ved=1t:2428&ictx=111",,,0.21
Spicerack Kitchens Pvt Ltd,Spicerack Kitchens,"With a rich legacy spanning 15 years, Spicerack has been at the forefront of transforming homes.From conceptualization to meticulous execution, we strive to comprehend your unique vision and translate it into captivating reality.

With our in-house factory and state-of-the-art production facility we have complete control of manufacturing processing ensuring best quality and attention to detail. This integration of design and production allows us to seamlessly bring your home to life.

Join us on this transformative journey where design, innovation, and craftsmanship converge to create homes that inspire and delight.",15,Bengaluru,https://www.spicerackkitchens.com/,Pradeep Balija Krishna,Managing Director,919164243452,1 to 50 Lakhs,Residential,130_logo.jpg,130_a.jpg,130_b.jpg,130_c.jpg,130_d.jpg,130_e.jpg,130_f.jpg,130_g.jpg,130_h.jpg,130_i.jpg,130_j.jpg,,1500.0,,130_reviews.jpg,hello@spicerackkitchens.com,4.5,11,"https://www.google.com/maps/place/Spicerack+kitchens+Pvt+Ltd+-+Experience+Center/@12.9811514,77.6014164,15z/data=!4m2!3m1!1s0x0:0x7630d7aee4646ed7?sa=X&ved=1t:2428&ictx=111",,,1.1
Imly Studio,Imly Studio,"At Imly, we deliver world-class products integrated with certified raw materials from around the globe. Imly Home Furniture is built with the finest raw materials, hardware, and accessories, hand-picked to produce exceptional quality and finish.

Backed by an experienced workforce and state-of-the-art infrastructure, Imly promises to deliver world-class products in line with international standards. With a vision to be a front runner in the industry, Imly constantly strives to innovate and give precision to its product to last.

Imly has something to offer every design enthusiast with an exclusive range of products with different finishes, textures and colours. At Imly, we offer top-notch products with a touch of elegance and value for money.",20,Bengaluru,https://www.imlystudio.com/,Akhila Madamanchi,Interior Designer,919606032020,1 to 50 Lakhs,Residential,131_logo.jpg,131_a.jpg,131_b.jpg,131_c.jpg,131_d.jpg,131_e.jpg,131_f.jpg,131_g.jpg,131_h.jpg,131_i.jpg,131_j.jpg,,,,131_reviews.jpg,hello@imlystudio.com,5.0,3,"https://www.google.com/maps/place/Imly+Studio+-+Infantry+Road/@12.9795219,77.6059034,15z/data=!4m2!3m1!1s0x0:0xd5f0eb1720a729dc?sa=X&ved=1t:2428&ictx=111",,,0.53
