The Innovative Interiors,The Innovative Interiors,"The Innovative Interiors journey towards becoming one of the Leading Interiors in Bangalore. Since our inception, we have set our sights to emerge as one of the best interior designers by building a strong reputation as being a trustworthy and excellent service provider.

Being an interior design firm that seeks to deliver the best to our customers, our team of interior designers dedicate their efforts into designing spaces that are often characterized by smart and logical utilization of space, beautiful design, lush greenery and sensitivity towards external environment.",16,Bengaluru,https://theinnovativeinteriors.com/,,,918050072181,1 to 50 Lakhs,Residential,36_logo.jpg,36_a.jpg,36_b.jpg,36_c.jpg,36_d.jpg,36_e.jpg,36_f.jpg,36_g.jpg,36_h.jpg,36_i.jpg,36_j.jpg,,,,36_reviews.jpg,info@theinnovativeinteriors.com,4.6,52,"https://www.google.com/maps/place/The+Innovative+Interiors/@12.9336427,77.7588977,15z/data=!4m6!3m5!1s0x3bae0dded9b3b911:0x29d4f430296471dd!8m2!3d12.9336427!4d77.7588977!16s%2Fg%2F11rk05xdgh?entry=ttu",,,0.98
Dreamhouzz,DreamHouzz Architecture & Interiors,"DreamHouzz Interiors is engaged with converting your dream home into reality, highend finishes and attention to detail. DreamHouzz is a studio well observed for its highly tailored & bespoke client tactics from concept to delivery.

Our target is to inspire our clients with wonderful job which satisfies our customer needs beyond their expectations giving unique designs with perfect result.

DreamHouzz is more zealous about all features of design & believes it’s anvital module providing a wide-ranging and successful project. The target is always on creating spaces that are sophisticated, refined and genuinely reflecting a client’s personality or brand. Our studio proudly collaborates with leading Interior designers & Architects  in Bangalore.

We are one of the top notch designing, importing and executing firm in revamping and rebuilding of your old space. We believe that each bit of architecture and interior must be unique and should be made to exist in sync of harmony with the surrounding environment while responding to its wider global environment.

We have carved our very own niche in the design world with our one of a kind style and approach. It has been made possible because of our strong business ethos and uncompromised frame of mind with regards to attaining complete client satisfaction.",7,Bengaluru,https://dreamhouzz.co.in/,Girish L Y,CEO & Founder,917795749218,1 to 50 Lakhs,"Residential, Commercial",37_logo.jpg,37_a.jpg,37_b.jpg,37_c.jpg,37_d.jpg,37_e.jpg,37_f.jpg,37_g.jpg,37_h.jpg,37_i.jpg,37_j.jpg,,,,37_reviews.jpg,contact@dreamhouzz.co.in,4.9,63,"https://www.google.com/maps/place/DreamHouzz+Architecture+%26+Interiors+:+Best+interior+designer/@12.8919654,77.580455,15z/data=!4m2!3m1!1s0x0:0xc72f1a1ebc88405?sa=X&ved=1t:2428&ictx=111",,,1.12
RAV Interiors,RAV Interiors,"Established in 2016, we are a Bengaluru – based interior design company, specializing in private residential, office spaces and multi-unit developments. Our expertise extends across all stages of design and execution. From feasibility studies, planning applications, conceptual and detailed design through to monitoring execution on-site, procurement, dressing and hand-over, ensuring each project is finished to the highest level of quality.",9,Bengaluru,https://www.ravinteriors.com/,Radhakrishna Muppiri,Founder,919538848579,1 to 50 Lakhs,"Residential, Commercial",38_logo.jpg,38_a.jpg,38_b.jpg,38_c.jpg,38_d.jpg,38_e.jpg,38_f.jpg,38_g.jpg,38_h.jpg,38_i.jpg,38_j.jpg,,2500.0,,38_reviews.jpg,info@ravinteriors.com,4.5,291,"https://www.google.com/maps/place/RAV+Interiors/@12.927369,77.5775484,15z/data=!4m6!3m5!1s0x3bae15ad39468fd3:0x34ba153c0aab943e!8m2!3d12.927369!4d77.5775484!16s%2Fg%2F11r8ndkrtt?entry=ttu", they have won 23 Awards so far in their journey,,2.15
Blucap LLP,Blucap Interiors,"Blucap, is synonymous with exquisite taste, unparalleled service, and unmatched quality. Operating with the utmost in business ethics, we are known for our reliability and attention to detail on every project making your experience with us authentically different. The team at Blucap, lend our expertise and passion for design to each commercial and residential project we undertake. As a collective team, the designers create both modern and traditional designs with a unique twist, turning any space into a powerful expression of the client’s personality. Innovation is at the heart of Blucap Philosophy!
As a company, we prefer a collaborative approach to design that encourages our clients to develop and hone their own style and taste. We provide value to our clients by discouraging short-lived trends, opting instead for quality and timelessness. The final design ensures a beautiful, comfortable, and most importantly a functional space for our clients. We recognize that the most important element in our designs is the people who use them in the end.",8,Bengaluru,https://www.blucap.in/,Biju Varghese,Managing Director,919845264192,1 to 50 Lakhs,"Residential, Commercial",39_logo.jpg,39_a.jpg,39_b.jpg,39_c.jpg,39_d.jpg,39_e.jpg,39_f.jpg,39_g.jpg,39_h.jpg,39_i.jpg,39_j.jpg,,625.0,,39_reviews.jpg,interiors@blucap.in,4.8,70,"https://www.google.com/maps/place/BLUCAP+INTERIORS/@12.9666258,77.6078941,15z/data=!4m6!3m5!1s0x3bae142ab687a185:0x476d72f513ffe43e!8m2!3d12.9666258!4d77.6078941!16s%2Fg%2F11dzxcg26w?entry=ttu", they have won 23 Awards so far in their journey,,1.92
Ace Interior & Architect,Ace Interiors & Architects,"Ace Interiors & Architects, a sub unit of the Ace Group of companies, is an Udupi, Mangalore and Bangalore based Interior design and Architecture Company which has been turning diverse customers’ dreams into reality through inspired, innovative and integrity-driven approaches. Our design philosophy combines style with functionality to create environments that breathe life. For years now, our reputation has been one of outstanding service underpinned by an expert, energetic team that works tirelessly to deliver. We partner with professional Architects, Interior Designers, Engineers, Project Managers, and others to design and construct premium interiors for a wide variety of spaces. Our ultimate vision is to ensure that our client’s vision is fulfilled.",,"Bengaluru, Mangalore, Udupi",https://aceinteriors.co/,Prerna Radhakrishna,Senior Designer & Design Head,919845500234,1 to 50 Lakhs,"Residential, Commercial",40_logo.jpg,40_a.jpg,40_b.jpg,40_c.jpg,40_d.jpg,40_e.jpg,40_f.jpg,40_g.jpg,40_h.jpg,40_i.jpg,40_j.jpg,,,https://drive.google.com/file/d/1eP8qHmQaypKEzJcQHgu8KsspmcbOn0ku/view?usp=sharing,40_reviews.jpg,info@aceinteriors.co,5.0,45,"https://www.google.com/maps/place/Ace+Interiors+%26+Architects/@12.9787866,77.6352517,15z/data=!4m6!3m5!1s0x3bae178abd54f9c5:0xea8fa209e469a011!8m2!3d12.9787866!4d77.6352517!16s%2Fg%2F11tsfthq1_?entry=ttu"," Architecture & Interior Design Excellence Awards & Conference 2022 - National Edition, Karnataka Business Awards 2022, Innovative Leadership Award 2022, Indian Glory Awards 2022, Bhartiya Udyog Ratna Award 2022",,0.7
Cee Bee Design Studio Pvt. Ltd,Cee Bee Design Studio,"Cee Bee Design Studio – a pan India interior designing company. We are one of the best interior designers in Bangalore, Kolkata, Goa and Hyderabad. We provide creative interiors with our expert designers at affordable prices.

We have successfully completed over 1000+ residential interior projects - including apartments, villas, bungalows, penthouses, duplex. Besides that, we have completed over 300+ commercial interior projects such as office spaces, restaurants, boutique hotels, model homes for developers like the Birla Group, Zuari, Siddha Group and others.

We specialize in European and Contemporary interior designs for modular kitchens, living room, bedroom, dining room etc.

We believe in excellence, quality, honesty and transparency. Our mission statement is Transforming Spaces Transforming Lives. We aim to not only transform the homeowner for whom we work but also for those home creators who work for us.",11,"Bengaluru, Kolkata",https://www.ceebeedesignstudio.com/,Chitralekha Biswas,Chief Executive Officer,917477722403,1 to 50 Lakhs,"Residential, Commercial",41_logo.jpg,41_a.jpg,41_b.jpg,41_c.jpg,41_d.jpg,41_e.jpg,41_f.jpg,41_g.jpg,41_h.jpg,41_i.jpg,41_j.jpg,,1300.0,,41_reviews.jpg,chitralekha@ceebeedesignstudio.com,4.3,121,"https://www.google.com/maps/place/Cee+Bee+Design+Studio/@12.9674762,77.6366078,15z/data=!4m6!3m5!1s0x3bae3d9566afe26f:0xe326cfbab79a1e3a!8m2!3d12.9674762!4d77.6366078!16s%2Fg%2F11dyqxsn2x?entry=ttu"," Hafele Awards for Best Residential Villas 2023, Hafele Awards for Best Micro Living 2023, MSME- Leading Designing Firm of The Year 2020 - Pan India Award of Excellence, MSME- Entrepreneurship Award of Excellence 2020, Best Business 2021 (Interior Designing) by Three Best Rated, The First Ever Designation- Women's Award 2021, Best Design Award- Hafele, Star Award- Hafele",,2.36
Aakruthi Interiors,Aakruthi Interiors,"We focus exclusively on Spaces through the lens of interior architecture—a radical idea in 2012, when AAkruthi Interiors was founded. We are highly connected agents of change, committed to creativity, innovation, growth, & our communities.

Through innovation, research, and building on smart, highly creative solutions that embody our clients, we advance the field. As an employee-owned firm, our diverse and multi-talented professionals are passionate, intense, and deeply client focused.

We’re inspired working alongside our clients to resolve complex issues and design highly energized environments where people thrive. Through our work we strive to share our passion with our clients.",13,Bengaluru,https://aakruthiinteriors.in/,Anoop Mukundan,CEO & Founder,919663786213,1 to 50 Lakhs,"Residential, Commercial",42_logo.jpg,42_a.jpg,42_b.jpg,42_c.jpg,42_d.jpg,42_e.jpg,42_f.jpg,42_g.jpg,42_h.jpg,42_i.jpg,42_j.jpg,,860.0,,42_reviews.jpg,marketing@aakruthiinteriors.in,4.4,88,"https://www.google.com/maps/place/Aakruthi+Interiors/@12.986683,77.5599597,15z/data=!4m6!3m5!1s0x3bae3df5162c106f:0xb10563612d675885!8m2!3d12.986683!4d77.5599597!16s%2Fg%2F1pp2wz8ry?entry=ttu",,,1.77
ONNEXT Interio,ONNEXT Interio,"At ONNEXT Interio, we believe that every space has the potential to be beautiful, functional, and sustainable. That’s why we take a collaborative approach to every project, working closely with our clients to understand their needs, preferences, and budget. From there, we develop a customized design plan that reflects their unique style and vision.

Our team of experienced architects, interior designers, and construction professionals are dedicated to delivering exceptional results. We use the latest technology and construction techniques to ensure that every project is completed on time, on budget, and to the highest standards of quality.

At ONNEXT Interio, we are passionate about creating spaces that inspire and delight. Whether you’re looking to renovate your home, build a new office, or develop a residential project, we’re here to help. Contact us today to schedule a consultation and discover how we can help bring your vision to life.",6,Bengaluru,https://onnext.in/,Mohammed Mudabbir,Founder,919972333360,1 to 50 Lakhs,"Residential, Commercial",43_logo.jpg,43_a.jpg,43_b.jpg,43_c.jpg,43_d.jpg,43_e.jpg,43_f.jpg,43_g.jpg,43_h.jpg,43_i.jpg,43_j.jpg,,1000.0,,43_reviews.jpg,info@onnext.in,5.0,28,"https://www.google.com/maps/place/ONNEXT+Interio+-+Interior+Designers+in+Bangalore/@12.9338357,77.6176074,15z/data=!4m6!3m5!1s0x3bae6d1a5669819d:0xf1017bf6da6104f4!8m2!3d12.9338357!4d77.6176074!16s%2Fg%2F11h0_n3xds?entry=ttu"," Most Promising Interior Designing Company of the Year, Fastest Emerging Interior Design Company of the Year 2024, Indian Iconic Interior Design Firm of the Year 2024",,1.78
Plykart Interiors,Plykart Interiors,"Plykart Interiors is a Bangalore-based Interior Design Company operating since 2000. We offer the best workmanship with quality work and time management schedule. Being the best interior designers in Bangalore, we are bound to be professional, ethical, and technically excellent. Our clients matter to us and keeping them satisfied through our work is our primary goal.

Our dedication is to include esteem underline work with profitability and adaptability. We offer customized furniture for your residential as well as commercial set-up. Be it a an Apartment, a room, Shopping Mall, Retail outlet or an Office setup, we cater to all the segments of interior designs. We take up turnkey projects and offer our services with efficiency, thrilling esthetics, celestial ambience, and Product longevity. Work execution like closets, kitchen and so on are made at the industrial premises and later moved to the site when the design is complete. Looking for Residential Interior Designers in Bangalore? Drop us an email and our experts shall get in touch with you.",25,Bengaluru,https://www.plykart.in/,Jeeten Patel,Senior Designer,919481908807,1 to 50 Lakhs,"Residential, Commercial",44_logo.jpg,44_a.jpg,44_b.jpg,44_c.jpg,44_d.jpg,44_e.jpg,44_f.jpg,44_g.jpg,44_h.jpg,44_i.jpg,44_j.jpg,,,,44_reviews.jpg,plykartinteriors@gmail.com,4.5,54,"https://www.google.com/maps/place/Plykart+Interiors/@12.8787933,77.5994194,15z/data=!4m6!3m5!1s0x3bae152ce3a29377:0xbfb4e7f40c4ed04!8m2!3d12.8787933!4d77.5994194!16s%2Fg%2F11gh7ltq15?entry=ttu",,,0.99
Chattels Design,Chattels Design,"Every home tells a unique story of the people living there. We strongly believe homes should be timeless, elegant and functional luxurious havens where you can relax, entertain and spend time with family. We are your one-stop interior design firm in Bangalore serving over 350+ of satisfied home owners.

At Chattels Design, we understand the significance of your home and our unwavering commitment to excellence guarantees exceptional quality and durability that will endure the test of time. Home is the ultimate expression of your aspirations and desires. Our expert Interior Designers in Bangalore team is dedicated to collaborating with you to create spaces that flawlessly embody your distinct style and way of living.

Combining our mastery of interior design and project management, we provide our clients with effortless journeys from concept to completion. In sync with ever-evolving trends and international standards, our expert team is always searching for new ways to create and transform living spaces.",6,Bengaluru,https://www.chattelsdesign.com/,Itisha Jalan,Founder & CEO,918861963344,1 to 50 Lakhs,Residential,45_logo.jpg,45_a.jpg,45_b.jpg,45_c.jpg,45_d.jpg,45_e.jpg,45_f.jpg,45_g.jpg,45_h.jpg,45_i.jpg,45_j.jpg,,350.0,,45_reviews.jpg,chattelsdesign@gmail.com,4.5,268,"https://www.google.com/maps/place/Chattels+Design+-+Interior+Designers+in+Bangalore/@12.9571603,77.7362334,15z/data=!4m6!3m5!1s0x3bae13a581410d81:0xf501e297f8a5b24f!8m2!3d12.9571603!4d77.7362334!16s%2Fg%2F11h1mjdwjb?entry=ttu", Most Innovative & Futuristic Interior Design Firm of the Year 2023,,2.4
SpaceC Designs,Space C Designs,"Space C Designs is a leading interior design and decoration company in Bangalore, with over 10 years of experience serving clients across the city. We specialize in designing and decorating homes, offices, and commercial spaces that are both stylish and functional. Our team of experienced and creative designers will work with you to create a space that reflects your unique personality and needs. We offer a wide range of services, including: Interior design consultation Space planning Furniture selection Lighting design Flooring selection Wall and window treatments Accessories selection Project management If you are looking for interior designers near me or interior designers in Bangalore, please contact us today for a free consultation.",10,Bengaluru,https://spacecdesigns.com/,Varughese Mathew,Interior Designer,918310468137,1 to 50 Lakhs,Residential,46_logo.jpg,46_a.jpg,46_b.jpg,46_c.jpg,46_d.jpg,46_e.jpg,46_f.jpg,46_g.jpg,46_h.jpg,46_i.jpg,46_j.jpg,,1500.0,,46_reviews.jpg,spacecaccnt@gmail.com,5.0,55,"https://www.google.com/maps/place/Space+C+Designs+-+Interior+Designers+in+Bangalore/@12.8927004,77.6249214,15z/data=!4m6!3m5!1s0x3bae15895ae99ce5:0x62e0d93c10feced7!8m2!3d12.8927004!4d77.6249214!16s%2Fg%2F11tx_r6gm7?entry=ttu",,,1.55
De Panache,De Panache,"De Panache has been creating top-quality interior designs for over 10 years. Our ability to listen and distil the key components of our clients’ needs and desires is what enables her to prepare functional space planning. With a team of passionate interior designers, we are always pushing the bar by doing something unique and exciting for our clients.

Choosing to work with Depanache will save you countless hours defining and enhancing your own distinctive style. Our team is highly skilled at space planning, and furniture arrangement and will provide you with a design that makes daily living functional, safe and comfortable. We source materials across the globe and give our clients an array of different combinations to choose from.

Having completed a variety of projects in both the residential and commercial sectors, our reputation has been built on thoughtful, creative and intuitively responsive design tailored to reflect the wishes of clients.",15,Bengaluru,https://depanache.in/,Atreyee Choudhury,Founder & Principal Interior Architect,919620131348,1 to 50 Lakhs,"Residential, Commercial",47_logo.jpg,47_a.jpg,47_b.jpg,47_c.jpg,47_d.jpg,47_e.jpg,47_f.jpg,47_g.jpg,47_h.jpg,47_i.jpg,47_j.jpg,,1000.0,,47_reviews.jpg,info@depanacheinteriors.com,4.4,116,"https://www.google.com/maps/place/De+Panache/@12.9319626,77.6234345,15z/data=!4m6!3m5!1s0x3bae145003d4cf97:0xf63c584551fa600e!8m2!3d12.9319626!4d77.6234345!16s%2Fg%2F1ptxy0r22?entry=ttu",,,1.88
Q Oak Interiors And Modular Solutions Pvt. Ltd.,Q Oak Interiors,"Q Oak Interiors is your premier destination for residential and commercial interior design in Bengaluru. With over 15+ years of experience, we specialize in modern interior design, luxury home decor, kitchen designs, custom furniture, and home staging services. Our professional team is determined to offer the best interior design service in Bangalore.",4,Bengaluru,https://qoakinteriors.com/,Abhishek Naidu Panduranga,Director,919845087213,1 to 50 Lakhs,"Residential, Commercial",48_logo.jpg,48_a.jpg,48_b.jpg,48_c.jpg,48_d.jpg,48_e.jpg,48_f.jpg,48_g.jpg,48_h.jpg,48_i.jpg,48_j.jpg,,1000.0,,48_reviews.jpg,sales@qoakinteriors.com,4.8,264,"https://www.google.com/maps/place/Q+Oak+Interiors/@12.8892974,77.5817359,15z/data=!4m2!3m1!1s0x0:0x308089778e44d1ff?sa=X&ved=1t:2428&ictx=111",,,1.86
Kuvio Studio,Kuvio Studio,"We are a team of passionate, energetic, creative and inquisitive designers with interests ranging from travel, dancing, reading, cooking to animals. We are always drawing inspiration from our surroundings, constantly questioning what we see and how it can be applied to the world of design.

Our passion for design translates into seamless, unique and timeless spatial experiences. We approach each design project with just the right amount of excitement and passion, enabling us to effectively translate clients’ requirements into seamless, unique and timeless spatial experiences.

",12,Bengaluru,https://www.kuviostudio.com/,Richa Singh,Founder,919900810362,1 to 50 Lakhs,"Residential, Commercial",49_logo.jpg,49_a.jpg,49_b.jpg,49_c.jpg,49_d.jpg,49_e.jpg,49_f.jpg,49_g.jpg,49_h.jpg,49_i.jpg,49_j.jpg,,,,49_reviews.jpg,info@kuviostudio.com,4.0,49,"https://www.google.com/maps/place/Kuvio+Studio/@13.0181,77.6460848,15z/data=!4m6!3m5!1s0x3bae1444ac172c9b:0xf5a7e4c9aa5fec3!8m2!3d13.0181!4d77.6460848!16s%2Fg%2F1pp2tw5rz?entry=ttu",,,0.89
Interiordesk Furniture Pvt Ltd,InteriorDesk,"Among so many interior designer firms vying for attention, it is difficult indeed to pick and choose from among them. But we at Interior Desk have a specially trained and experienced team of professionals who believe in excellence and quality. Be it interior designers, engineers or architects, our team boasts of seasoned and expert professionals. Whether it renovating an existing setup or constructing a new layout, our team of experts work well together and come up with the perfect results.

The color combinations are worked out with the color consultants. In your residential interior design, a variety of designs are available to work upon which are offered by us. The creative and aesthetic interior designers work with many styles which include Fusion, Industrial, Classic, and Modern. Turning your drab kitchen into a glamorous one is wonderfully done by our talented workers. The best part is we give you a graphical display of your beautifully completed home beforehand, using 3D graphics with the latest technologies.

As far as the commercial interior design and office interior design is concerned, our team of experts does up your professional set up in marvelous tones and layouts. Once a client visits you to crack a business deal, the office is the first place he visits and an excellent residential premise will impress him.",2,Bengaluru,https://www.interiordesk.in/,Kardi Mahesh,Director,919901038971,1 to 50 Lakhs,"Residential, Commercial",50_logo.jpg,50_a.jpg,50_b.jpg,50_c.jpg,50_d.jpg,50_e.jpg,50_f.jpg,50_g.jpg,50_h.jpg,50_i.jpg,50_j.jpg,,200.0,,50_reviews.jpg,info@interiordesk.in,5.0,31,"https://www.google.com/maps/place/InteriorDesk+%7C+Best+Interior+Designers+in+Bangalore+%7C+Budget+Interior+Design/@12.9119211,77.6490091,15z/data=!4m2!3m1!1s0x0:0x8b087ad469fc876a?sa=X&ved=1t:2428&ictx=111",,,1.01
Dezignare India,Dezignare India,"Dezignare India is an interior design firm that was established with a passion to bring life into spaces of one’s dream. Founder Anil Skariah and his team of experts have gained in-depth experience in transforming mere brick-and-mortar buildings into lively spaces, be it residential, or commercial.

Backed by the philosophy, “The difference lies in the details,” we undertake painstaking attention to detail not just in design but also in our approach to customer service. The client’s needs, dreams, and personal tastes are paramount during the design process and, hence, our team works closely with them during the course of the project so as to achieve the designated target.

Our expertise lies in creating soulful designs that enrich people’s lives. We collaborate with a network of world-class professionals across fields with the aim to deliver outstanding design ideas and solutions for clients through the creative blending of human need, environmental stewardship, value creation, and art.

Through the entire process of designing and implementation, we offer solutions for the minutest of details and come up with new ways to address challenges in the ‘real’ world of interiors. Our group of interior designers works in tandem with the client’s resources and helps them create a space that fulfills his requirement.

It is our endeavor to continue to evolve in our journey of providing interior solutions to people by imbibing the latest trends and technologies.",17,Bengaluru,http://www.dezignareindia.com/,Anil Skariah,Operations Manager,919886142838,1 to 50 Lakhs,"Residential, Commercial",51_logo.jpg,51_a.jpg,51_b.jpg,51_c.jpg,51_d.jpg,51_e.jpg,51_f.jpg,51_g.jpg,51_h.jpg,51_i.jpg,51_j.jpg,,299.0,,51_reviews.jpg,info@dezignareindia.com,4.6,98,"https://www.google.com/maps/place/Dezignare+India/@12.9189363,77.6510774,15z/data=!4m6!3m5!1s0x3bae14822a2cc5bd:0xd82c29b298a32487!8m2!3d12.9189363!4d77.6510774!16s%2Fg%2F1pp2wyykg?entry=ttu",,,1.9
Atticarch,Atticarch,"ATTICARCH is a multi-disciplinary Consultancy Firm, providing Architectural, Interior Designing and project management services to domestic and corporate clients. Since our establishment in 2002 we have come a long way in providing an array of Architectural services and consultancy services to our Clients.

ATTICARCH as a firm was started with the sole aim of providing a One stop solution for Clients who are looking for various Architectural & Interior Designing solutions to suit their Budgets.",23,Bengaluru,https://atticarch.com/,Guna Sekhar,Manager Operations,919845013138,1 to 50 Lakhs,"Residential, Commercial",52_logo.jpg,52_a.jpg,52_b.jpg,52_c.jpg,52_d.jpg,52_e.jpg,52_f.jpg,52_g.jpg,52_h.jpg,52_i.jpg,52_j.jpg,,,,52_reviews.jpg,sales@atticarch.com,4.4,38,"https://www.google.com/maps/place/ATTICARCH+-+Best+Interior+Designers+in+Bangalore+(Interior+Design+Company)/@13.0132131,77.6485128,15z/data=!4m6!3m5!1s0x3bae172ad3fc200d:0x8ccafb28a7d52400!8m2!3d13.0132131!4d77.6485128!16s%2Fg%2F1pp2vm3pp?entry=ttu",,,0.83
Best Interiors,Best Interiors,"At Best interiors, we believe that your home should be more than just a place to live - it should be a reflection of your unique personality, style, and aspirations.

 As a leading interior design firm based at vibrant city Bangalore  , we specialize in creating interiors that blend beauty, functionality and  innovation to enhance your living  experience",15,Bengaluru,https://bestinteriorsz.com/,,,919986997250,1 to 50 Lakhs,Residential,53_logo.jpg,53_a.jpg,53_b.jpg,53_c.jpg,53_d.jpg,53_e.jpg,53_f.jpg,53_g.jpg,53_h.jpg,53_i.jpg,53_j.jpg,,1000.0,,53_reviews.jpg,mail@bestinteriorsz.com,5.0,46,"https://www.google.com/maps/place/Best+interiors/@12.9978282,77.6044494,15z/data=!4m6!3m5!1s0x3bae176cadbe00ab:0x921645528c9f69db!8m2!3d12.9978282!4d77.6044494!16s%2Fg%2F11tc0z1bh9?entry=ttu",,,1.46
